Unity Technologies||||Cuphead||||Hearthstone||||Pokemon Go||||Crash Bandicoot 4: It's About Time||||Assassin's Creed Valhalla
Epic Games||||Fortnite||||Gears of War||||Infinity Blade||||Fortnite Chapter 2 Season 8||||Tony Hawk's Pro Skater 1+2
Nintendo||||Super Mario Bros.||||The Legend of Zelda||||Pokemon||||Super Mario 3D World + Bowser's Fury||||Metroid Dread
Blizzard Entertainment||||World of Warcraft||||Diablo III||||Overwatch||||Diablo IV||||Overwatch 2
Rockstar Games||||Grand Theft Auto V||||Red Dead Redemption 2||||Bully||||Grand Theft Auto: The Trilogy - The Definitive Edition||||Grand Theft Auto Online
Sony Interactive Entertainment||||God of War||||Uncharted 4: A Thief's End||||The Last of Us Part II||||Ratchet & Clank: Rift Apart||||Demon's Souls
Bethesda Game Studios||||Fallout 4||||The Elder Scrolls V: Skyrim||||Doom (2016)||||Deathloop||||Ghostwire: Tokyo
CD Projekt Red||||The Witcher 3: Wild Hunt||||Cyberpunk 2077||||Thronebreaker: The Witcher Tales||||Cyberpunk 2077 Next-Gen Upgrade||||Cyberpunk 2077 Patch 1.31
Capcom||||Resident Evil 4||||Monster Hunter: World||||Street Fighter II||||Monster Hunter Rise||||Resident Evil Village
Electronic Arts||||The Sims||||FIFA series||||Mass Effect 2||||Knockout City||||Lost in Random
Ubisoft||||Assassin's Creed Odyssey||||Far Cry 5||||Watch Dogs 2||||Far Cry 6||||Rainbow Six Extraction
Square Enix||||Final Fantasy VII||||Tomb Raider||||Dragon Quest Builders||||Final Fantasy XIV: Endwalker||||Babylon's Fall
Valve Corporation||||Half-Life 2||||Portal 2||||Counter-Strike: Global Offensive||||Half-Life: Alyx||||Dota 2
Bungie||||Halo: Combat Evolved||||Destiny 2||||Myth|||Destiny 2: The Witch Queen||||Destiny 2: Season of the Lost
Naughty Dog||||Crash Bandicoot||||Uncharted 2: Among Thieves||||The Last of Us||||The Last of Us Part II||||Uncharted: Legacy of Thieves
343 Industries||||Halo 4||||Halo 5: Guardians||||Halo Infinite Beta||||Halo Infinite||||Halo: Fireteam Raven
Kojima Productions||||Metal Gear Solid||||Death Stranding||||Snatcher||||Death Stranding Director's Cut||||Death Stranding: Director's Cut Patch 2.01
NetherRealm Studios||||Mortal Kombat 11||||Injustice 2||||Mortal Kombat X||||Mortal Kombat 11: Aftermath||||Injustice 2: Legendary Edition
FromSoftware||||Dark Souls III||||Sekiro: Shadows Die Twice||||Bloodborne||||Elden Ring||||Dark Souls Remastered
Gearbox Software||||Borderlands 2||||Duke Nukem 3D||||Brothers in Arms: Hell's Highway||||Borderlands 3||||Tiny Tina's Wonderlands
Insomniac Games||||Ratchet & Clank|||Resistance: Fall of Man||||Spider-Man||||Spider-Man: Miles Morales||||Ratchet & Clank: Rift Apart
Sucker Punch Productions||||Sly Cooper and the Thievius Raccoonus||||InFamous||||Ghosts of Tsushima||||Ghosts of Tsushima: Director's Cut||||InFamous: Second Son
Bethesda Softworks||||The Elder Scrolls IV: Oblivion||||Dishonored||||DOOM Eternal||||Deathloop||||Starfield
Respawn Entertainment||||Titanfall 2||||Apex Legends||||Star Wars Jedi: Fallen Order||||Apex Legends: Emergence||||Apex Legends: Escape
Riot Games||||League of Legends||||Teamfight Tactics||||Valorant||||League of Legends: Wild Rift||||Valorant: Episode 3 Act 2
BioWare||||Baldur's Gate II: Shadows of Amn||||Star Wars: Knights of the Old Republic||||Mass Effect||||Mass Effect Legendary Edition||||Mass Effect: Legendary Edition Patch 1.04
Treyarch||||Call of Duty: Black Ops||||Call of Duty: Black Ops II||||Call of Duty: Black Ops Cold War||||Call of Duty: Vanguard||||Call of Duty: Black Ops Cold War Season Six
Turn 10 Studios||||Forza Motorsport 7||||Forza Horizon 4||||Forza Horizon 5||||Forza Motorsport 7 Patch 1.189||||Forza Horizon 5 Hot Wheels Legends Pack
Playdead||||Limbo||||Inside||||Limbo (iOS)||||Inside (PlayStation 4)
Square Enix Montreal||||Hitman GO||||Lara Croft GO||||Hitman Sniper||||Hitman GO: Definitive Edition||||Hitman Sniper Assassins
Niantic Inc.||||Ingress||||Pokémon GO||||Harry Potter: Wizards Unite||||Pokémon GO||||Harry Potter: Wizards Unite White Wyrm Growth Cycle II
PUBG Corporation||||PlayerUnknown's Battlegrounds||||PlayerUnknown's Battlegrounds Mobile||||PlayerUnknown's Battlegrounds: New State||||PlayerUnknown's Battlegrounds: New State Lv.3 Line Store Collab Bundle||||PlayerUnknown's Battlegrounds: New State Lv.1 Line Store Collab Bundle
Konami||||Metal Gear Solid V: The Phantom Pain||||Silent Hill 2||||Castlevania: Symphony of the Night||||eFootball 2022||||eFootball 2022: Gameplay Update
Ironhide Game Studio||||Kingdom Rush||||Kingdom Rush Frontiers||||Kingdom Rush Origins||||Kingdom Rush Vengeance||||Kingdom Rush Vengeance: Tower Defense Game
Devolver Digital||||Hotline Miami||||Enter the Gungeon||||Katana ZERO||||Sludge Life||||Shadow Warrior 3
Remedy Entertainment||||Max Payne 2: The Fall of Max Payne||||Alan Wake||||Control||||Control Ultimate Edition||||CrossfireX
Supergiant Games||||Bastion||||Transistor||||Hades||||Hades: The Long Winter Update||||Hades: Combat Practices Resource Pack
10 Chambers Collective||||GTFO||||GTFO: Rundown 005 Rebirth||||GTFO: Combat Challenge Mode Event||||GTFO: Combat Challenge Mode Event
Running with Scissors||||Postal 2||||POSTAL 4: No Regerts||||POSTAL Redux||||POSTAL 4: No Regerts Patch 1.3.0||||POSTAL 4: No Regerts Patch 1.3.1
Hello Games||||Joe Danger||||No Man's Sky||||The Last Campfire||||No Man's Sky||||The Last Campfire
PopCap Games||||Plants vs. Zombies||||Bejeweled 3||||Peggle||||Plants vs. Zombies: Battle for Neighborville||||Bejeweled Stars
Mediatonic||||Fall Guys: Ultimate Knockout||||Fall Guys: Season 2||||Fall Guys: Ultimate Knockout||||Fall Guys: Season 2
Turtle Rock Studios||||Left 4 Dead||||Evolve||||Back 4 Blood||||Back 4 Blood: Vev Beta Patch 0.7.0||||Back 4 Blood: Blooded Edition Pack
Ready at Dawn||||Daxter||||God of War: Chains of Olympus||||God of War: Ghost of Sparta||||Lone Echo II||||Echo VR - The Lab - Open Beta
Monolith Productions||||No One Lives Forever 2: A Spy in H.A.R.M.'s Way||||F.E.A.R.||||Guardians of Middle-earth||||Middle-earth: Shadow of War||||Middle-earth: Shadow of War - Definitive Edition
Larian Studios||||Divinity: Original Sin II||||Baldur's Gate 3||||Divinity: Original Sin||||Divinity: Original Sin 2 - Definitive Edition||||Baldur's Gate 3 - Patch 4
Obsidian Entertainment||||Fallout: New Vegas||||Star Wars: Knights of the Old Republic II||||South Park: The Stick of Truth||||The Outer Worlds||||The Outer Worlds: Murder on Eridanos
Digital Extremes||||Warframe||||Dark Sector||||The Darkness II||||Warframe: Sisters of Parvos||||Warframe: Sisters of Parvos
SQUARE ENIX TAITO||||Bubble Bobble||||Space Invaders||||Qbert||||GROOVE COASTER||||Music RPG Project 'WORLD OF INDIE GO!' beta

